{
  "case_id": "HC-0201",
  "actual_action": "Russia launched the announced military operation on 24 February 2022. Russian forces attacked across multiple axes and against targets well beyond the pre-existing Donbas contact line, beginning the full-scale phase of the Russia–Ukraine war.",
  "later_evidence": [
    "On 2 March 2022 the UN General Assembly adopted resolution ES-11/1, titled 'Aggression against Ukraine', by 141 votes to 5 with 35 abstentions. The resolution deplored the Russian Federation's use of force and demanded withdrawal of Russian military forces; Russia rejected that characterisation and maintained its stated self-defence/Donbas rationale.",
    "On 16 March 2022, at the provisional-measures stage of Ukraine v. Russian Federation under the Genocide Convention, the International Court of Justice stated that it was not then in possession of evidence substantiating Russia's allegation that genocide had been committed on Ukrainian territory. The Court emphasised that the provisional order did not prejudge jurisdiction, admissibility or the merits and ordered Russia to suspend the military operations commenced on 24 February by a 13-2 vote.",
    "The invasion rapidly produced very large civilian displacement and a major refugee crisis, while military and civilian casualties, destruction and territorial control continued to evolve over the subsequent war.",
    "The war's later conduct generated many separate allegations and findings concerning attacks, occupation, detention, deportation, weapons and other conduct by specific actors. Those are not treated as evidence for the 24 February initiation decision and require separate Crucible cases."
  ],
  "outcomes": [
    "The operation's practical scope extended far beyond a geographically limited intervention around Donetsk/Luhansk and involved large-scale force against Ukraine as a state.",
    "The legal and moral justification offered before the operation became the subject of immediate multilateral challenge, including UN General Assembly and International Court of Justice proceedings.",
    "The invasion created risks and harms on a scale far beyond the pre-existing Donbas contact-line conflict, including large displacement and regional escalation."
  ],
  "later_reviews_or_findings": [
    "The UN General Assembly's ES-11/1 vote is evidence of the position adopted by a large majority of member states; it is not treated as a substitute for the Crucible's own principle-by-principle reasoning.",
    "The ICJ's 16 March statement concerning lack of substantiating genocide evidence was made at the provisional-measures stage and must not be misrepresented as a final merits judgment on every legal issue raised by the war.",
    "This case is retained to test whether The Moral Code can simultaneously acknowledge genuine local violence and security concerns while imposing a high burden before broad interstate force, and without using later Russian or Ukrainian conduct as retrospective permission or condemnation for the initiation decision."
  ]
}
